<!ELEMENT catalogo_cd (disco+)>
<!ELEMENT disco (artista,anno,precio,ncanciones)>
<!ATTLIST disco titulo CDATA #REQUIRED>
<!ELEMENT artista (#PCDATA)>
<!ELEMENT anno (#PCDATA)>
<!ELEMENT precio (#PCDATA)>
<!ELEMENT ncanciones (#PCDATA)>